PMID,Title,Authors,Citation,First Author,Journal/Book,Publication Year,Create Date,PMCID,NIHMS ID,DOI
"16139186","Opioid switch in palliative care, opioid choice by clinical need and opioid availability","Müller-Busch HC, Lindena G, Tietze K, Woskanjan S.","Eur J Pain. 2005 Oct;9(5):571-9. doi: 10.1016/j.ejpain.2004.12.003. Epub 2005 Jan 20.","Müller-Busch HC","Eur J Pain","2005","2005/09/06","","","10.1016/j.ejpain.2004.12.003"
"16116010","The effects of femoral nerve blockade in conjunction with epidural analgesia after total knee arthroplasty","YaDeau JT, Cahill JB, Zawadsky MW, Sharrock NE, Bottner F, Morelli CM, Kahn RL, Sculco TP.","Anesth Analg. 2005 Sep;101(3):891-5, table of contents. doi: 10.1213/01.ANE.0000159150.79908.21.","YaDeau JT","Anesth Analg","2005","2005/08/24","","","10.1213/01.ANE.0000159150.79908.21"
"16111163","Evaluation of induction by use of a combination of oxymorphone and diazepam or hydromorphone and diazepam and maintenance of anesthesia by use of isoflurane in dogs with experimentally induced hypovolemia","Machado CG, Dyson DH, Mathews KA.","Am J Vet Res. 2005 Jul;66(7):1227-37. doi: 10.2460/ajvr.2005.66.1227.","Machado CG","Am J Vet Res","2005","2005/08/23","","","10.2460/ajvr.2005.66.1227"
"16105253","GC-MS quantitation of codeine, morphine, 6-acetylmorphine, hydrocodone, hydromorphone, oxycodone, and oxymorphone in blood","Meatherall R.","J Anal Toxicol. 2005 Jul-Aug;29(5):301-8. doi: 10.1093/jat/29.5.301.","Meatherall R","J Anal Toxicol","2005","2005/08/18","","","10.1093/jat/29.5.301"
"16101709","Perioperative management of a child with short-chain acyl-CoA dehydrogenase deficiency","Turpin B, Tobias JD.","Paediatr Anaesth. 2005 Sep;15(9):771-7. doi: 10.1111/j.1460-9592.2005.01507.x.","Turpin B","Paediatr Anaesth","2005","2005/08/17","","","10.1111/j.1460-9592.2005.01507.x"
"16084182","Eliminating analgesic meperidine use with a supported formulary restriction","O'Connor AB, Lang VJ, Quill TE.","Am J Med. 2005 Aug;118(8):885-9. doi: 10.1016/j.amjmed.2005.01.061.","O'Connor AB","Am J Med","2005","2005/08/09","","","10.1016/j.amjmed.2005.01.061"
"16078132","The use of a sum of inverse Gaussian functions to describe the absorption profile of drugs exhibiting complex absorption","Csajka C, Drover D, Verotta D.","Pharm Res. 2005 Aug;22(8):1227-35. doi: 10.1007/s11095-005-5266-8. Epub 2005 Aug 3.","Csajka C","Pharm Res","2005","2005/08/04","","","10.1007/s11095-005-5266-8"
"16061458","Rotation to methadone after opioid dose escalation: How should individualization of dosing occur?","Zimmermann C, Seccareccia D, Booth CM, Cottrell W.","J Pain Palliat Care Pharmacother. 2005;19(2):25-31.","Zimmermann C","J Pain Palliat Care Pharmacother","2005","2005/08/03","","",""
"16050714","Decoration of the aromatic ring of dihydrocodeinone (hydrocodone) and 14-hydroxydihydrocodeinone (oxycodone)","Wilson ML, Carroll PJ, Dalton DR.","J Org Chem. 2005 Aug 5;70(16):6492-5. doi: 10.1021/jo050264+.","Wilson ML","J Org Chem","2005","2005/07/30","","","10.1021/jo050264+"
"16041941","[Observational data in elderly pain patients show that fear of opioid therapy is unfounded]","Junker U, Figge V.","MMW Fortschr Med. 2005 Jul 7;147(27-28):43.","Junker U","MMW Fortschr Med","2005","2005/07/27","","",""
"15997113","Bioactivation of morphine in human liver: isolation and identification of morphinone, a toxic metabolite","Todaka T, Ishida T, Kita H, Narimatsu S, Yamano S.","Biol Pharm Bull. 2005 Jul;28(7):1275-80. doi: 10.1248/bpb.28.1275.","Todaka T","Biol Pharm Bull","2005","2005/07/06","","","10.1248/bpb.28.1275"
"15963867","Comparative efficacy of oral extended-release hydromorphone and immediate-release hydromorphone in patients with persistent moderate to severe pain: two randomized controlled trials","Grosset AB, Roberts MS, Woodson ME, Shi M, Swanton RE, Reder RF, Buckley BJ.","J Pain Symptom Manage. 2005 Jun;29(6):584-94. doi: 10.1016/j.jpainsymman.2004.10.008.","Grosset AB","J Pain Symptom Manage","2005","2005/06/21","","","10.1016/j.jpainsymman.2004.10.008"
"15951653","The effect of opioids on driving and psychomotor performance in patients with chronic pain","Byas-Smith MG, Chapman SL, Reed B, Cotsonis G.","Clin J Pain. 2005 Jul-Aug;21(4):345-52. doi: 10.1097/01.ajp.0000125244.29279.c1.","Byas-Smith MG","Clin J Pain","2005","2005/06/14","","","10.1097/01.ajp.0000125244.29279.c1"
"15940943","[Pain therapy. Extensive possibilities not adequately utilized]","","MMW Fortschr Med. 2005 May 12;147(19):60-1.","","MMW Fortschr Med","2005","2005/06/09","","",""
"15923838","The efficacy of continuous local anesthetic infiltration in breast surgery: reduction mammaplasty and reconstruction","Lu L, Fine NA.","Plast Reconstr Surg. 2005 Jun;115(7):1927-34; discussion 1935-6. doi: 10.1097/01.prs.0000163332.04220.bd.","Lu L","Plast Reconstr Surg","2005","2005/06/01","","","10.1097/01.prs.0000163332.04220.bd"
"15907647","Hydromorphone","Murray A, Hagen NA.","J Pain Symptom Manage. 2005 May;29(5 Suppl):S57-66. doi: 10.1016/j.jpainsymman.2005.01.007.","Murray A","J Pain Symptom Manage","2005","2005/05/24","","","10.1016/j.jpainsymman.2005.01.007"
"15838207","Use of the infusion pain pump following transverse rectus abdominis muscle flap breast reconstruction","Losken A, Parris JJ, Douglas TD, Codner MA.","Ann Plast Surg. 2005 May;54(5):479-82. doi: 10.1097/01.sap.0000155277.74482.4c.","Losken A","Ann Plast Surg","2005","2005/04/20","","","10.1097/01.sap.0000155277.74482.4c"
"15831778","Clinical pharmacology and pharmacokinetics of once-daily hydromorphone hydrochloride extended-release capsules","Vashi V, Harris S, El-Tahtawy A, Wu D, Cipriano A.","J Clin Pharmacol. 2005 May;45(5):547-54. doi: 10.1177/0091270005274552.","Vashi V","J Clin Pharmacol","2005","2005/04/16","","","10.1177/0091270005274552"
"15828941","Opioids heal ischemic wounds in the rat","Poonawala T, Levay-Young BK, Hebbel RP, Gupta K.","Wound Repair Regen. 2005 Mar-Apr;13(2):165-74. doi: 10.1111/j.1067-1927.2005.130207.x.","Poonawala T","Wound Repair Regen","2005","2005/04/15","","","10.1111/j.1067-1927.2005.130207.x"
"15806533","The use of opioids in the postoperative setting: focus on morphine, hydromorphone, and fentanyl","Golembiewski J, Torrecer S, Katke J.","J Perianesth Nurs. 2005 Apr;20(2):141-3. doi: 10.1016/j.jopan.2005.02.007.","Golembiewski J","J Perianesth Nurs","2005","2005/04/05","","","10.1016/j.jopan.2005.02.007"
"15767975","Palladone for chronic pain","","Med Lett Drugs Ther. 2005 Mar 14;47(1204):21-3.","","Med Lett Drugs Ther","2005","2005/03/16","","",""
"15761703","Contribution to variability in response to opioids","Hanks GW, Reid C.","Support Care Cancer. 2005 Mar;13(3):145-52. doi: 10.1007/s00520-004-0730-2. Epub 2004 Dec 10.","Hanks GW","Support Care Cancer","2005","2005/03/12","","","10.1007/s00520-004-0730-2"
"15716559","The risk of cesarean delivery with neuraxial analgesia given early versus late in labor","Wong CA, Scavone BM, Peaceman AM, McCarthy RJ, Sullivan JT, Diaz NT, Yaghmour E, Marcus RJ, Sherwani SS, Sproviero MT, Yilmaz M, Patel R, Robles C, Grouper S.","N Engl J Med. 2005 Feb 17;352(7):655-65. doi: 10.1056/NEJMoa042573.","Wong CA","N Engl J Med","2005","2005/02/18","","","10.1056/NEJMoa042573"
"15696936","[Determination of hydromorphone in Beagle dogs plasma by liquid chromatography-tandem mass spectrometry]","Li XY, Chen XY, Yan QY, Zhang ZH, Xu JH, Jin X, Zhong DF.","Yao Xue Xue Bao. 2004 Nov;39(11):929-32.","Li XY","Yao Xue Xue Bao","2004","2005/02/09","","",""
"15667467","Prospective audit of short-term concurrent ketamine, opioid and anti-inflammatory ('triple-agent') therapy for episodes of acute on chronic pain","Good P, Tullio F, Jackson K, Goodchild C, Ashby M.","Intern Med J. 2005 Jan;35(1):39-44. doi: 10.1111/j.1445-5994.2004.00727.x.","Good P","Intern Med J","2005","2005/01/26","","","10.1111/j.1445-5994.2004.00727.x"
"15662898","[Pain reduced and quality of life improved by sustained-release hydromorphone. Results of an observational study]","Sittig HB.","MMW Fortschr Med. 2004 Dec 9;146(Suppl 3-4):95-8.","Sittig HB","MMW Fortschr Med","2004","2005/01/25","","",""
"15646717","[Pain reduced and quality of life improved by sustained-release hydromorphone. Results of an observational study]","Sittig HB.","MMW Fortschr Med. 2004 Dec 2;146(49):45.","Sittig HB","MMW Fortschr Med","2004","2005/01/14","","",""
"15644759","Postoperative analgesia following surgical correction for adolescent idiopathic scoliosis: a comparison of continuous epidural analgesia and patient-controlled analgesia","Sucato DJ, Duey-Holtz A, Elerson E, Safavi F.","Spine (Phila Pa 1976). 2005 Jan 15;30(2):211-7. doi: 10.1097/01.brs.0000150832.53604.64.","Sucato DJ","Spine (Phila Pa 1976)","2005","2005/01/13","","","10.1097/01.brs.0000150832.53604.64"
"15638351","Reports of epidural infusion errors","Koczmara C.","Dynamics. 2004 Winter;15(4):8.","Koczmara C","Dynamics","2004","2005/01/11","","",""
"15589085","Stability of clonidine in clonidine-hydromorphone mixture from implanted intrathecal infusion pumps in chronic pain patients","Rudich Z, Peng P, Dunn E, McCartney C.","J Pain Symptom Manage. 2004 Dec;28(6):599-602. doi: 10.1016/j.jpainsymman.2004.02.018.","Rudich Z","J Pain Symptom Manage","2004","2004/12/14","","","10.1016/j.jpainsymman.2004.02.018"
"15532435","Successful treatment of hydromorphone-induced neurotoxicity and hyperalgesia","Chung KS, Carson S, Glassman D, Vadivelu N.","Conn Med. 2004 Oct;68(9):547-9.","Chung KS","Conn Med","2004","2004/11/10","","",""
"15502034","A multiple-dose phase I study of intranasal hydromorphone hydrochloride in healthy volunteers","Rudy AC, Coda BA, Archer SM, Wermeling DP.","Anesth Analg. 2004 Nov;99(5):1379-86; table of contents. doi: 10.1213/01.ANE.0000132927.47528.8B.","Rudy AC","Anesth Analg","2004","2004/10/27","","","10.1213/01.ANE.0000132927.47528.8B"
"15500571","Pharmacokinetic and pharmacodynamic evaluation of intravenous hydromorphone in cats","Wegner K, Robertson SA, Kollias-Baker C, Sams RA, Muir WW 3rd.","J Vet Pharmacol Ther. 2004 Oct;27(5):329-36. doi: 10.1111/j.1365-2885.2004.00593.x.","Wegner K","J Vet Pharmacol Ther","2004","2004/10/27","","","10.1111/j.1365-2885.2004.00593.x"
"15488893","Identification and synthesis of norhydromorphone, and determination of antinociceptive activities in the rat formalin test","Zheng M, McErlane KM, Ong MC.","Life Sci. 2004 Nov 12;75(26):3129-46. doi: 10.1016/j.lfs.2004.06.008.","Zheng M","Life Sci","2004","2004/10/19","","","10.1016/j.lfs.2004.06.008"
"15452522","A shift from demerol (meperidine) to dilaudid (hydromorphone) improves pain control and decreases admissions for patients in sickle cell crisis","Perlman KM, Myers-Phariss S, Rhodes JC.","J Emerg Nurs. 2004 Oct;30(5):439-46. doi: 10.1016/j.jen.2004.06.016.","Perlman KM","J Emerg Nurs","2004","2004/09/29","","","10.1016/j.jen.2004.06.016"
"15353098","Hydromorphone neuroexcitation","Thwaites D, McCann S, Broderick P.","J Palliat Med. 2004 Aug;7(4):545-50. doi: 10.1089/jpm.2004.7.545.","Thwaites D","J Palliat Med","2004","2004/09/09","","","10.1089/jpm.2004.7.545"
"15344360","Evaluation of the effects of premedication on gastroduodenoscopy in cats","Smith AA, Posner LP, Goldstein RE, Ludders JW, Erb HN, Simpson KW, Gleed RD.","J Am Vet Med Assoc. 2004 Aug 15;225(4):540-4. doi: 10.2460/javma.2004.225.540.","Smith AA","J Am Vet Med Assoc","2004","2004/09/04","","","10.2460/javma.2004.225.540"
"15336340","Massive hydromorphone dose delivered subcutaneously instead of intrathecally: guidelines for prevention and management of opioid, local anesthetic, and clonidine overdose","Coyne PJ, Hansen LA, Laird J, Buster P, Smith TJ.","J Pain Symptom Manage. 2004 Sep;28(3):273-6. doi: 10.1016/j.jpainsymman.2003.11.011.","Coyne PJ","J Pain Symptom Manage","2004","2004/09/01","","","10.1016/j.jpainsymman.2003.11.011"
"15310785","Acetaminophen (paracetamol) improves pain and well-being in people with advanced cancer already receiving a strong opioid regimen: a randomized, double-blind, placebo-controlled cross-over trial","Stockler M, Vardy J, Pillai A, Warr D.","J Clin Oncol. 2004 Aug 15;22(16):3389-94. doi: 10.1200/JCO.2004.09.122.","Stockler M","J Clin Oncol","2004","2004/08/18","","","10.1200/JCO.2004.09.122"
"15281651","Comparative cardiovascular, analgesic, and sedative effects of medetomidine, medetomidine-hydromorphone, and medetomidine-butorphanol in dogs","Kuo WC, Keegan RD.","Am J Vet Res. 2004 Jul;65(7):931-7. doi: 10.2460/ajvr.2004.65.931.","Kuo WC","Am J Vet Res","2004","2004/07/30","","","10.2460/ajvr.2004.65.931"
"15271246","Correlation between withdrawal symptoms and medication pump residual volume in patients with implantable SynchroMed pumps","Taha J, Favre J, Janszen M, Galarza M, Taha A.","Neurosurgery. 2004 Aug;55(2):390-3; discussion 393-4. doi: 10.1227/01.neu.0000129698.73730.e4.","Taha J","Neurosurgery","2004","2004/07/24","","","10.1227/01.neu.0000129698.73730.e4"
"15268978","Role of individual human cytochrome P450 enzymes in the in vitro metabolism of hydromorphone","Benetton SA, Borges VM, Chang TK, McErlane KM.","Xenobiotica. 2004 Apr;34(4):335-44. doi: 10.1080/00498250310001657559.","Benetton SA","Xenobiotica","2004","2004/07/23","","","10.1080/00498250310001657559"
"15148975","Fluoxetine + hydromorphone: serotonin syndrome?","","Prescrire Int. 2004 Apr;13(70):57.","","Prescrire Int","2004","2004/05/20","","",""
"15105246","Epidural treatment in advanced cancer patients","Mercadante S.","Anesth Analg. 2004 May;98(5):1503; auhtor reply 1503-4. doi: 10.1213/01.ane.0000114585.53663.2b.","Mercadante S","Anesth Analg","2004","2004/04/24","","","10.1213/01.ane.0000114585.53663.2b"
"15099916","A laboratory study of hydromorphone and cyclazocine on smoking behavior in residential polydrug users","Pickworth WB, Lee EM, Abreu ME, Umbricht A, Preston KL.","Pharmacol Biochem Behav. 2004 Apr;77(4):711-5. doi: 10.1016/j.pbb.2004.01.022.","Pickworth WB","Pharmacol Biochem Behav","2004","2004/04/22","","","10.1016/j.pbb.2004.01.022"
"15099699","Receptor mechanisms mediating cyanide generation in PC12 cells and rat brain","Gunasekar PG, Prabhakaran K, Li L, Zhang L, Isom GE, Borowitz JL.","Neurosci Res. 2004 May;49(1):13-8. doi: 10.1016/j.neures.2004.01.006.","Gunasekar PG","Neurosci Res","2004","2004/04/22","","","10.1016/j.neures.2004.01.006"
"15098525","Postoperative respiratory depression and unresponsiveness following epidural opiate administration: a case report","Holmes J, Maye JP.","AANA J. 2004 Apr;72(2):126-8.","Holmes J","AANA J","2004","2004/04/22","","",""
"15096909","Cyclazocine: comparison to hydromorphone and interaction with cocaine","Preston KL, Umbricht A, Schroeder JR, Abreu ME, Epstein DH, Pickworth WB.","Behav Pharmacol. 2004 Mar;15(2):91-102. doi: 10.1097/00008877-200403000-00001.","Preston KL","Behav Pharmacol","2004","2004/04/21","","","10.1097/00008877-200403000-00001"
"15067146","Personal accounts: a truly invisible handicap","Reiter E.","Psychiatr Serv. 2004 Apr;55(4):363-4. doi: 10.1176/appi.ps.55.4.363.","Reiter E","Psychiatr Serv","2004","2004/04/07","","","10.1176/appi.ps.55.4.363"
"15058769","Antinociceptive effects of hydromorphone, butorphanol, or the combination in cats","Lascelles BD, Robertson SA.","J Vet Intern Med. 2004 Mar-Apr;18(2):190-5. doi: 10.1892/0891-6640(2004)18<190:aeohbo>2.0.co;2.","Lascelles BD","J Vet Intern Med","2004","2004/04/03","","","10.1892/0891-6640(2004)18<190:aeohbo>2.0.co;2"
"14998425","CYP2D6 and CYP3A4 involvement in the primary oxidative metabolism of hydrocodone by human liver microsomes","Hutchinson MR, Menelaou A, Foster DJ, Coller JK, Somogyi AA.","Br J Clin Pharmacol. 2004 Mar;57(3):287-97. doi: 10.1046/j.1365-2125.2003.02002.x.","Hutchinson MR","Br J Clin Pharmacol","2004","2004/03/05","PMC1884456","","10.1046/j.1365-2125.2003.02002.x"
"14998329","Identification of opioid ligands possessing mixed micro agonist/delta antagonist activity among pyridomorphinans derived from naloxone, oxymorphone, and hydromorphone [correction of hydropmorphone]","Ananthan S, Khare NK, Saini SK, Seitz LE, Bartlett JL, Davis P, Dersch CM, Porreca F, Rothman RB, Bilsky EJ.","J Med Chem. 2004 Mar 11;47(6):1400-12. doi: 10.1021/jm030311v.","Ananthan S","J Med Chem","2004","2004/03/05","","","10.1021/jm030311v"
"14996233","Continuous intrathecal infusion of hydromorphone: safety in the sheep model and clinical implications","Johansen MJ, Satterfield WC, Baze WB, Hildebrand KR, Gradert TL, Hassenbusch SJ.","Pain Med. 2004 Mar;5(1):14-25. doi: 10.1111/j.1526-4637.2004.04010.x.","Johansen MJ","Pain Med","2004","2004/03/05","","","10.1111/j.1526-4637.2004.04010.x"
"14901621","A further report on the use of dilaudid as an analgesic in urology","LAIBE JE.","Urol Cutaneous Rev. 1952 Jan;56(1):26.","LAIBE JE","Urol Cutaneous Rev","1952","1952/01/01","","",""
"14804053","Dilaudid suppositories for the suppression of the cough reflex; with review of medication by rectal administration in childhood diseases","DONELSON K.","J Mich State Med Soc. 1951 Jan;50(1):61; passim.","DONELSON K","J Mich State Med Soc","1951","1951/01/01","","",""
"14751453","Precipitated opioid withdrawal across acute physical dependence induction methods","Compton P, Miotto K, Elashoff D.","Pharmacol Biochem Behav. 2004 Feb;77(2):263-8. doi: 10.1016/j.pbb.2003.10.017.","Compton P","Pharmacol Biochem Behav","2004","2004/01/31","","","10.1016/j.pbb.2003.10.017"
"14748271","Dr. Nancy Morrison and her dying patient: a case of medical necessity","Sneiderman B, Deutscher R.","Health Law J. 2002;10:1-30.","Sneiderman B","Health Law J","2002","2004/01/30","","",""
"14740785","Effect of fluticasone propionate nasal spray on bioavailability of intranasal hydromorphone hydrochloride in patients with allergic rhinitis","Davis GA, Rudy AC, Archer SM, Wermeling DP, McNamara PJ.","Pharmacotherapy. 2004 Jan;24(1):26-32. doi: 10.1592/phco.24.1.26.34810.","Davis GA","Pharmacotherapy","2004","2004/01/27","","","10.1592/phco.24.1.26.34810"
"14687955","Open-label trial of an injection depot formulation of buprenorphine in opioid detoxification","Sobel BF, Sigmon SC, Walsh SL, Johnson RE, Liebson IA, Nuwayser ES, Kerrigan JH, Bigelow GE.","Drug Alcohol Depend. 2004 Jan 7;73(1):11-22. doi: 10.1016/j.drugalcdep.2003.08.006.","Sobel BF","Drug Alcohol Depend","2004","2003/12/23","","","10.1016/j.drugalcdep.2003.08.006"
"14622682","A randomized study of the effect of oral lamotrigine and hydromorphone on pain and hyperalgesia following heat/capsaicin sensitization","Petersen KL, Maloney A, Hoke F, Dahl JB, Rowbotham MC.","J Pain. 2003 Sep;4(7):400-6. doi: 10.1016/s1526-5900(03)00718-1.","Petersen KL","J Pain","2003","2003/11/19","","","10.1016/s1526-5900(03)00718-1"
"14603608","[Pain therapy in patients with tumors. According to graduated schedule and hourly plan]","","MMW Fortschr Med. 2003 Oct 2;145(40):53.","","MMW Fortschr Med","2003","2003/11/08","","",""
"14598667","[Combined use of intrathecal morphine and diclofenac suppository for postoperative analgesia after caesarean section]","Hidaka I, Asai T, Miki T, Kubota T, Kawachi S.","Masui. 2003 Oct;52(10):1056-61.","Hidaka I","Masui","2003","2003/11/06","","",""
"14587190","[Pain therapy with semisynthetic opioids. Patients have opioid-type side effects more rarely]","Sohn W.","MMW Fortschr Med. 2003 Jul 10;145(27-28):50.","Sohn W","MMW Fortschr Med","2003","2003/11/01","","",""
"14572875","Antihyperalgesic effect of simultaneously released hydromorphone and bupivacaine from polymer fibers in the rat chronic constriction injury model","Hasirci V, Bonney I, Goudas LC, Shuster L, Carr DB, Wise DL.","Life Sci. 2003 Nov 14;73(26):3323-37. doi: 10.1016/s0024-3205(03)00615-5.","Hasirci V","Life Sci","2003","2003/10/24","","","10.1016/s0024-3205(03)00615-5"
"14562820","Oral vs. i.v. hydromorphone. Add a measure of caution","Cohen MR.","Nursing. 2003 Sep;33(9):12. doi: 10.1097/00152193-200309000-00011.","Cohen MR","Nursing","2003","2003/10/18","","","10.1097/00152193-200309000-00011"
"14516504","Calculating opioid dose conversions #36","Arnold R, Weissman DE.","J Palliat Med. 2003 Aug;6(4):619-20. doi: 10.1089/109662103768253731.","Arnold R","J Palliat Med","2003","2003/10/01","","","10.1089/109662103768253731"
"14453567","A peri-surgical evaluation of oxymorphone","KANE AA.","West Med Med J West. 1962 Jan;3:8-10.","KANE AA","West Med Med J West","1962","1962/01/01","","",""
"14446819","Numorphan in labor. A preliminary report","SIMECKOVA M, SHAW W, POOL E, NICHOLS EE.","Obstet Gynecol. 1960 Jul;16:119-23.","SIMECKOVA M","Obstet Gynecol","1960","1960/07/01","","",""
"14444630","The use of oxymorphone hydrochloride during anesthesia for operations on the head and neck. A preliminary report","SEIGLEMAN M, WASMUTH CE.","Cleve Clin Q. 1960 Jul;27:157-61. doi: 10.3949/ccjm.27.3.157.","SEIGLEMAN M","Cleve Clin Q","1960","1960/07/01","","","10.3949/ccjm.27.3.157"
"14393929","[Use of dilaudid-atropine as analgesic and pre-narcotic in urology]","GODENA S.","Minerva Urol. 1955 Mar-Apr;7(2):55-9.","GODENA S","Minerva Urol","1955","1955/03/01","","",""
"14366318","[Dialudid in pre-anesthesia]","MANNELLI A, VILLEVIELLE L, ZARA A.","G Ital Chir. 1954 Oct;10(10):836-48.","MANNELLI A","G Ital Chir","1954","1954/10/01","","",""
"14301008","COMPARATIVE DISTRIBUTION OF TRITIUM-LABELED DIHYDROMORPHINE BETWEEN MATERNAL AND FETAL RATS","SANNER JH, WOODS LA.","J Pharmacol Exp Ther. 1965 May;148:176-84.","SANNER JH","J Pharmacol Exp Ther","1965","1965/05/01","","",""
"14293547","RELATIVE POTENCY OF CODEINE, METHADONE AND DIHYDROMORPHINONE TO MORPHINE IN SELF-MAINTAINED ADDICT RATS","COLLINS RJ, WEEKS JR.","Naunyn Schmiedebergs Arch Exp Pathol Pharmakol. 1965 Jan 8;249:509-14. doi: 10.1007/BF00246557.","COLLINS RJ","Naunyn Schmiedebergs Arch Exp Pathol Pharmakol","1965","1965/01/08","","","10.1007/BF00246557"
"14286207","ORAL HYDROMORPHONE IN TRAUMA","GOLDBERG RI, SHUMAN FI.","Curr Ther Res Clin Exp. 1965 May;7:284-8.","GOLDBERG RI","Curr Ther Res Clin Exp","1965","1965/05/01","","",""
"14286206","A CONTROLLED CLINICAL EVALUATION OF THE ANALGESIC EFFECT OF ORAL HYDROMORPHONE","CASS LJ, FREDERIK WS.","Curr Ther Res Clin Exp. 1965 May;7:275-83.","CASS LJ","Curr Ther Res Clin Exp","1965","1965/05/01","","",""
"14282720","SOME RELATIONSHIPS BETWEEN CATECHOLAMINES AND MORPHINE-LIKE DRUGS","SMITH AA, GAVITT JA, KAPLAN M.","Recent Adv Biol Psychiatry. 1963;6:208-13.","SMITH AA","Recent Adv Biol Psychiatry","1963","1963/01/01","","",""
"14234072","[ACUTE COR PULMONALE]","HERBERG D.","Dtsch Med Wochenschr. 1965 Jan 8;90:66-9. doi: 10.1055/s-0028-1111295.","HERBERG D","Dtsch Med Wochenschr","1965","1965/01/08","","","10.1055/s-0028-1111295"
"14194766","A RAPID SCREENING TEST FOR POTENTIAL ADDICTION LIABILITY OF NEW ANALGESIC AGENTS","SHEMANO I, WENDEL H.","Toxicol Appl Pharmacol. 1964 May;6:334-9. doi: 10.1016/0041-008x(64)90075-4.","SHEMANO I","Toxicol Appl Pharmacol","1964","1964/05/01","","","10.1016/0041-008x(64)90075-4"
"14191433","[PHARMACOLOGICAL STUDIES ON MORPHINE DERIVATIVES. 3. ON THE CHEMICAL STRUCTURE-ACTIVITY RELATIONSHIPS OF 14-HYDROXYMORPHINE DERIVATIVES]","SEKI I, TAKAGI H, KOBAYASHI S.","Yakugaku Zasshi. 1964 Mar;84:280-6.","SEKI I","Yakugaku Zasshi","1964","1964/03/01","","",""
"14177953","WEBER-CHRISTIAN DISEASE, AMENORRHEA AND PREGNANCY. A CASE REPORT","MCCALL JO Jr.","Am J Obstet Gynecol. 1964 Jun 1;89:362-5. doi: 10.1016/0002-9378(64)90694-5.","MCCALL JO Jr","Am J Obstet Gynecol","1964","1964/06/01","","","10.1016/0002-9378(64)90694-5"
"14169837","STUDY OF LYSERGIC ACID DIETHYLAMIDE AS AN ANALGESIC AGENT","KAST EC, COLLINS VJ.","Anesth Analg. 1964 May-Jun;43:285-91.","KAST EC","Anesth Analg","1964","1964/05/01","","",""
"14165988","[ASSISTED SPINAL ANESTHESIA]","FAGARASANU I.","Lyon Chir. 1964 May;60:347-59.","FAGARASANU I","Lyon Chir","1964","1964/05/01","","",""
"14165239","THE CLINICAL EVALUATION OF MORPHINE AND ITS SUBSTITUTES AS ANALGESICS","LASAGNA L.","Pharmacol Rev. 1964 Mar;16:47-83.","LASAGNA L","Pharmacol Rev","1964","1964/03/01","","",""
"14160510","BARBITURATE USE IN NARCOTIC ADDICTS","HAMBURGER E.","JAMA. 1964 Aug 3;189:366-9. doi: 10.1001/jama.1964.03070050032007.","HAMBURGER E","JAMA","1964","1964/08/03","","","10.1001/jama.1964.03070050032007"
"14134729","DIHYDROMORPHINE IN PERIPHERAL NERVOUS TISSUE","KOSTERLITZ HW, THOMPSON JW, WALLIS DI.","Nature. 1964 Feb 15;201:719. doi: 10.1038/201719a0.","KOSTERLITZ HW","Nature","1964","1964/02/15","","","10.1038/201719a0"
"14130285","ANALGESICS FOR THE RELIEF OF PAIN. I. NARCOTIC ANALGESICS","WANG RI.","Wis Med J. 1964 Mar;63:164-5.","WANG RI","Wis Med J","1964","1964/03/01","","",""
"14125891","THE EFFECT OF MORPHINE AND RELATED SUBSTANCES ON THE TOXICITY OF VENOMS. I. CENTRUROIDES SCULPTURATUS EWING SCORPION VENOM","STAHNKE HL, DENGLER AH.","Am J Trop Med Hyg. 1964 Mar;13:346-51. doi: 10.4269/ajtmh.1964.13.346.","STAHNKE HL","Am J Trop Med Hyg","1964","1964/03/01","","","10.4269/ajtmh.1964.13.346"
"14125210","DRUG ADDICTION: A REVIEW","MEYERSTEIN AN.","J Sch Health. 1964 Feb;34:77-87. doi: 10.1111/j.1746-1561.1964.tb00462.x.","MEYERSTEIN AN","J Sch Health","1964","1964/02/01","","","10.1111/j.1746-1561.1964.tb00462.x"
"14111353","[EFFECT OF MORPHINE AND SIMILAR ANALGESICS ON THE ACTIVITY OF NICOTINE AND 5-HYDROXYTRYPTAMINE]","BANIC B, MEDAKOVIC M.","Acta Med Iugosl. 1963;17:175-86.","BANIC B","Acta Med Iugosl","1963","1963/01/01","","",""
"14090997","THERAPY OF CARDIOGENIC SHOCK","AGRESS CM.","Prog Cardiovasc Dis. 1963 Nov;6:236-54. doi: 10.1016/s0033-0620(63)80037-7.","AGRESS CM","Prog Cardiovasc Dis","1963","1963/11/01","","","10.1016/s0033-0620(63)80037-7"
"14090539","ESSAY ON PAEDIATRIC PRE-ANAESTHETIC MEDICATION","STETSON JB.","Br J Anaesth. 1963 Dec;35:811-6. doi: 10.1093/bja/35.12.811.","STETSON JB","Br J Anaesth","1963","1963/12/01","","","10.1093/bja/35.12.811"
