PMID,Title,Authors,Citation,First Author,Journal/Book,Publication Year,Create Date,PMCID,NIHMS ID,DOI
"9260070","Effects of abused drugs on psychomotor performance","Pickworth WB, Rohrer MS, Fant RV.","Exp Clin Psychopharmacol. 1997 Aug;5(3):235-41. doi: 10.1037//1064-1297.5.3.235.","Pickworth WB","Exp Clin Psychopharmacol","1997","1997/08/01","","","10.1037//1064-1297.5.3.235"
"9253142","In vivo and in vitro formation of morphinone from morphine in rat","Yamano S, Takahashi A, Todaka T, Toki S.","Xenobiotica. 1997 Jul;27(7):645-56. doi: 10.1080/004982597240244.","Yamano S","Xenobiotica","1997","1997/07/01","","","10.1080/004982597240244"
"9249122","Effect of the intensity of transcutaneous acupoint electrical stimulation on the postoperative analgesic requirement","Wang B, Tang J, White PF, Naruse R, Sloninsky A, Kariger R, Gold J, Wender RH.","Anesth Analg. 1997 Aug;85(2):406-13. doi: 10.1097/00000539-199708000-00029.","Wang B","Anesth Analg","1997","1997/08/01","","","10.1097/00000539-199708000-00029"
"9237407","Oral narcotic protocol to reduce narcotic injections in refractory migraine patients","Von Seggern RL, Adelman JU.","Headache. 1997 Jun;37(6):341-5. doi: 10.1046/j.1526-4610.1997.3706341.x.","Von Seggern RL","Headache","1997","1997/06/01","","","10.1046/j.1526-4610.1997.3706341.x"
"9231864","Differences among patients in opioid self-administration during bone marrow transplantation","Chapman CR, Donaldson GW, Jacobson RC, Hautman B.","Pain. 1997 Jul;71(3):213-23. doi: 10.1016/s0304-3959(97)03355-1.","Chapman CR","Pain","1997","1997/07/01","","","10.1016/s0304-3959(97)03355-1"
"9208156","Antinociceptive and immunosuppressive effects of opiate drugs: a structure-related activity study","Sacerdote P, Manfredi B, Mantegazza P, Panerai AE.","Br J Pharmacol. 1997 Jun;121(4):834-40. doi: 10.1038/sj.bjp.0701138.","Sacerdote P","Br J Pharmacol","1997","1997/06/01","PMC1564723","","10.1038/sj.bjp.0701138"
"9200172","Hydromorphone analgesia after intravenous bolus administration","Coda B, Tanaka A, Jacobson RC, Donaldson G, Chapman CR.","Pain. 1997 May;71(1):41-8. doi: 10.1016/s0304-3959(97)03336-8.","Coda B","Pain","1997","1997/05/01","","","10.1016/s0304-3959(97)03336-8"
"9184729","Compatibility of hydromorphone and prochlorperazine, and irritation due to subcutaneous prochlorperazine infusion","Trinkle R.","Ann Pharmacother. 1997 Jun;31(6):789-90. doi: 10.1177/106002809703100624.","Trinkle R","Ann Pharmacother","1997","1997/06/01","","","10.1177/106002809703100624"
"9143356","Purification, characterization and partial primary structure of morphine 6-dehydrogenase from rabbit liver cytosol","Yamano S, Ito K, Ogata S, Toki S.","Arch Biochem Biophys. 1997 May 1;341(1):81-8. doi: 10.1006/abbi.1997.9961.","Yamano S","Arch Biochem Biophys","1997","1997/05/01","","","10.1006/abbi.1997.9961"
"9134180","Headache, circumoral paresthesia, and facial flushing associated with high-dose carmustine infusion","Woo MH, Ippoliti C, Bruton J, Mehra R, Champlin R, Przepiorka D.","Bone Marrow Transplant. 1997 Apr;19(8):845-7. doi: 10.1038/sj.bmt.1700743.","Woo MH","Bone Marrow Transplant","1997","1997/04/01","","","10.1038/sj.bmt.1700743"
"9121813","Clinical analgesic equivalence for morphine and hydromorphone with prolonged PCA","Dunbar PJ, Chapman CR, Buckley FP, Gavrin JR.","Pain. 1996 Dec;68(2-3):265-70. doi: 10.1016/s0304-3959(96)03213-7.","Dunbar PJ","Pain","1996","1996/12/01","","","10.1016/s0304-3959(96)03213-7"
"9106815","Intravenous methadone for cancer pain unrelieved by morphine and hydromorphone: clinical observations","Manfredi PL, Borsook D, Chandler SW, Payne R.","Pain. 1997 Mar;70(1):99-101. doi: 10.1016/s0304-3959(96)03313-1.","Manfredi PL","Pain","1997","1997/03/01","","","10.1016/s0304-3959(96)03313-1"
"9103485","Inhibition of cytochrome P450 2D6 metabolism of hydrocodone to hydromorphone does not importantly affect abuse liability","Kaplan HL, Busto UE, Baylon GJ, Cheung SW, Otton SV, Somer G, Sellers EM.","J Pharmacol Exp Ther. 1997 Apr;281(1):103-8.","Kaplan HL","J Pharmacol Exp Ther","1997","1997/04/01","","",""
"9085953","Patient-controlled epidural analgesia: interactions between nalbuphine and hydromorphone","Parker RK, Holtmann B, White PF.","Anesth Analg. 1997 Apr;84(4):757-63. doi: 10.1097/00000539-199704000-00011.","Parker RK","Anesth Analg","1997","1997/04/01","","","10.1097/00000539-199704000-00011"
"9085402","The effects of buprenorphine in buprenorphine-maintained volunteers","Strain EC, Walsh SL, Preston KL, Liebson IA, Bigelow GE.","Psychopharmacology (Berl). 1997 Feb;129(4):329-38. doi: 10.1007/s002130050199.","Strain EC","Psychopharmacology (Berl)","1997","1997/02/01","","","10.1007/s002130050199"
"9083166","Comparative clinical efficacy and safety of a novel controlled-release oxycodone formulation and controlled-release hydromorphone in the treatment of cancer pain","Hagen NA, Babul N.","Cancer. 1997 Apr 1;79(7):1428-37.","Hagen NA","Cancer","1997","1997/04/01","","",""
"9052302","Effects of ketorolac versus bupivacaine coadministration during patient-controlled hydromorphone epidural analgesia after thoracotomy procedures","Singh H, Bossard RF, White PF, Yeatts RW.","Anesth Analg. 1997 Mar;84(3):564-9. doi: 10.1097/00000539-199703000-00018.","Singh H","Anesth Analg","1997","1997/03/01","","","10.1097/00000539-199703000-00018"
"8958101","Engineering pathways in Escherichia coli for the synthesis of morphine alkaloid analgesics and antitussives","Hailes AM, French CE, Rathbone DA, Bruce NC.","Ann N Y Acad Sci. 1996 Oct 12;799:391-6. doi: 10.1111/j.1749-6632.1996.tb33230.x.","Hailes AM","Ann N Y Acad Sci","1996","1996/10/12","","","10.1111/j.1749-6632.1996.tb33230.x"
"8958080","Morphinone reductase. Characterization, cloning, and application to biocatalytic hydromorphone production","French CE, Hailes AM, Rathbone DA, Bruce NC.","Ann N Y Acad Sci. 1996 Oct 12;799:97-101. doi: 10.1111/j.1749-6632.1996.tb33185.x.","French CE","Ann N Y Acad Sci","1996","1996/10/12","","","10.1111/j.1749-6632.1996.tb33185.x"
"8930155","N-cyclobutylmethyl analog of normorphinone, N-CBM-TAMO: a short-term opioid agonist and long-term Mu-selective irreversible opioid antagonist","Xu JY, Seyed-Mozaffari A, Archer S, Bidlack JM.","J Pharmacol Exp Ther. 1996 Nov;279(2):539-47.","Xu JY","J Pharmacol Exp Ther","1996","1996/11/01","","",""
"8930154","Effects of naltrexone on response to intravenous cocaine, hydromorphone and their combination in humans","Walsh SL, Sullivan JT, Preston KL, Garner JE, Bigelow GE.","J Pharmacol Exp Ther. 1996 Nov;279(2):524-38.","Walsh SL","J Pharmacol Exp Ther","1996","1996/11/01","","",""
"8926748","The detection of hydrocodone in meconium: two case studies","Moore CM, Deitermann D, Lewis D, Leikin J.","J Anal Toxicol. 1995 Oct;19(6):514-8. doi: 10.1093/jat/19.6.514.","Moore CM","J Anal Toxicol","1995","1995/10/01","","","10.1093/jat/19.6.514"
"8917240","Patient-controlled analgesia for mucositis pain in children: a three-period crossover study comparing morphine and hydromorphone","Collins JJ, Geake J, Grier HE, Houck CS, Thaler HT, Weinstein HJ, Twum-Danso NY, Berde CB.","J Pediatr. 1996 Nov;129(5):722-8. doi: 10.1016/s0022-3476(96)70156-7.","Collins JJ","J Pediatr","1996","1996/11/01","","","10.1016/s0022-3476(96)70156-7"
"8895238","Individualized use of methadone and opioid rotation in the comprehensive management of cancer pain associated with poor prognostic indicators","Vigano A, Fan D, Bruera E.","Pain. 1996 Sep;67(1):115-9. doi: 10.1016/0304-3959(96)03112-0.","Vigano A","Pain","1996","1996/09/01","","","10.1016/0304-3959(96)03112-0"
"8893076","21-day compatibility of hydromorphone hydrochloride and promethazine hydrochloride in a cassette","Henderson F.","Am J Health Syst Pharm. 1996 Oct 1;53(19):2338-9. doi: 10.1093/ajhp/53.19.2338.","Henderson F","Am J Health Syst Pharm","1996","1996/10/01","","","10.1093/ajhp/53.19.2338"
"8861402","Stability of opioid craving over time as measured by visual analog scales","McMillan DE, Gilmore-Thomas K.","Drug Alcohol Depend. 1996 Mar;40(3):235-9. doi: 10.1016/0376-8716(96)01218-5.","McMillan DE","Drug Alcohol Depend","1996","1996/03/01","","","10.1016/0376-8716(96)01218-5"
"8835667","Lack of hydrocodone and hydromorphone interference in the GC-MS detection of morphine and codeine","Brooks KE, Smith NB.","J Anal Toxicol. 1996 Jul-Aug;20(4):269-70. doi: 10.1093/jat/20.4.269.","Brooks KE","J Anal Toxicol","1996","1996/07/01","","","10.1093/jat/20.4.269"
"8826555","Stability and compatibility of fluorouracil with morphine sulfate and hydromorphone hydrochloride","Xu QA, Trissel LA, Martinez JF.","Ann Pharmacother. 1996 Jul-Aug;30(7-8):756-61. doi: 10.1177/106002809603000709.","Xu QA","Ann Pharmacother","1996","1996/07/01","","","10.1177/106002809603000709"
"8826516","In vitro and in vivo studies of subcutaneous hydromorphone implants designed for the treatment of cancer pain","Lesser GJ, Grossman SA, Leong KW, Lo H, Eller S.","Pain. 1996 May-Jun;65(2-3):265-72. doi: 10.1016/0304-3959(95)00248-0.","Lesser GJ","Pain","1996","1996/05/01","","","10.1016/0304-3959(95)00248-0"
"8823239","Opioid antagonist effects of dezocine in opioid-dependent humans","Strain EC, Preston KL, Liebson IA, Bigelow GE.","Clin Pharmacol Ther. 1996 Aug;60(2):206-17. doi: 10.1016/S0009-9236(96)90137-X.","Strain EC","Clin Pharmacol Ther","1996","1996/08/01","","","10.1016/S0009-9236(96)90137-X"
"8819513","Effects of the structurally novel opioid 14 alpha, 14' beta-[dithiobis [(2-oxo-2,1-ethanediyl)imino]]bis(7,8-dihydromorphinone) on schedule-controlled behavior and thermal nociception in rhesus monkeys","Gatch MB, Negus SS, Mello NK, Archer S, Bidlack JM.","J Pharmacol Exp Ther. 1996 Sep;278(3):1282-9.","Gatch MB","J Pharmacol Exp Ther","1996","1996/09/01","","",""
"8809281","Stability of deferoxamine mesylate, floxuridine, fluorouracil, hydromorphone hydrochloride, lorazepam, and midazolam hydrochloride in polypropylene infusion-pump syringes","Stiles ML, Allen LV Jr, Prince SJ.","Am J Health Syst Pharm. 1996 Jul 1;53(13):1583-8. doi: 10.1093/ajhp/53.13.1583.","Stiles ML","Am J Health Syst Pharm","1996","1996/07/01","","","10.1093/ajhp/53.13.1583"
"8773867","Epidural morphine vs hydromorphone in post-caesarean section patients","Halpern SH, Arellano R, Preston R, Carstoniu J, O'Leary G, Roger S, Sandler A.","Can J Anaesth. 1996 Jun;43(6):595-8. doi: 10.1007/BF03011773.","Halpern SH","Can J Anaesth","1996","1996/06/01","","","10.1007/BF03011773"
"8756381","Opioid rotation in patients with cancer pain. A retrospective comparison of dose ratios between methadone, hydromorphone, and morphine","Bruera E, Pereira J, Watanabe S, Belzile M, Kuehn N, Hanson J.","Cancer. 1996 Aug 15;78(4):852-7. doi: 10.1002/(SICI)1097-0142(19960815)78:4<852::AID-CNCR23>3.0.CO;2-T.","Bruera E","Cancer","1996","1996/08/15","","","10.1002/(SICI)1097-0142(19960815)78:4<852::AID-CNCR23>3.0.CO;2-T"
"8664465","Beta-selective monoamine oxidase inhibitors and cardiac anesthesia","Cerza RF.","J Cardiothorac Vasc Anesth. 1995 Dec;9(6):717-9. doi: 10.1016/s1053-0770(05)80235-6.","Cerza RF","J Cardiothorac Vasc Anesth","1995","1995/12/01","","","10.1016/s1053-0770(05)80235-6"
"8653484","Stability of bupivacaine hydrochloride and hydromorphone hydrochloride during simulated epidural coadministration","Christen C, Johnson CE, Walters JR.","Am J Health Syst Pharm. 1996 Jan 15;53(2):170-3. doi: 10.1093/ajhp/53.2.170.","Christen C","Am J Health Syst Pharm","1996","1996/01/15","","","10.1093/ajhp/53.2.170"
"8622092","A randomized, double-blind, double-dummy, crossover trial comparing the safety and efficacy of oral sustained-release hydromorphone with immediate-release hydromorphone in patients with cancer pain. Canadian Palliative Care Clinical Trials Group","Bruera E, Sloan P, Mount B, Scott J, Suarez-Almazor M.","J Clin Oncol. 1996 May;14(5):1713-7. doi: 10.1200/JCO.1996.14.5.1713.","Bruera E","J Clin Oncol","1996","1996/05/01","","","10.1200/JCO.1996.14.5.1713"
"8614375","Pain palliation with strontium-89 in children with metastatic disease","Charron M, Brown M, Rowland P, Mirro J.","Med Pediatr Oncol. 1996 Jun;26(6):393-6. doi: 10.1002/(SICI)1096-911X(199606)26:6<393::AID-MPO4>3.0.CO;2-C.","Charron M","Med Pediatr Oncol","1996","1996/06/01","","","10.1002/(SICI)1096-911X(199606)26:6<393::AID-MPO4>3.0.CO;2-C"
"8610865","A multidimensional comparison of morphine and hydromorphone patient-controlled analgesia","Rapp SE, Egan KJ, Ross BK, Wild LM, Terman GW, Ching JM.","Anesth Analg. 1996 May;82(5):1043-8. doi: 10.1097/00000539-199605000-00029.","Rapp SE","Anesth Analg","1996","1996/05/01","","","10.1097/00000539-199605000-00029"
"8594121","Use of patient-controlled analgesia for pain control for children receiving bone marrow transplant","Dunbar PJ, Buckley P, Gavrin JR, Sanders JE, Chapman CR.","J Pain Symptom Manage. 1995 Nov;10(8):604-11. doi: 10.1016/0885-3924(95)00122-0.","Dunbar PJ","J Pain Symptom Manage","1995","1995/11/01","","","10.1016/0885-3924(95)00122-0"
"8547554","Pain outcomes after thoracotomy: lumbar epidural hydromorphone versus intrapleural bupivacaine","Gaeta RR, Macario A, Brodsky JB, Brock-Utne JG, Mark JB.","J Cardiothorac Vasc Anesth. 1995 Oct;9(5):534-7. doi: 10.1016/s1053-0770(05)80136-3.","Gaeta RR","J Cardiothorac Vasc Anesth","1995","1995/10/01","","","10.1016/s1053-0770(05)80136-3"
"8545138","Custom-made capsules and suppositories of methadone for patients on high-dose opioids for cancer pain","Bruera E, Watanabe S, Fainsinger RL, Spachynski K, Suarez-Almazor M, Inturrisi C.","Pain. 1995 Aug;62(2):141-6. doi: 10.1016/0304-3959(94)00257-f.","Bruera E","Pain","1995","1995/08/01","","","10.1016/0304-3959(94)00257-f"
"7694857","Antinociceptive evaluation of 14 beta-(bromoacetamido)-7,8-dihydro- N(cyclopropylmethyl)-normorphinone in mice","Jiang Q, Seyed-Mozaffari A, Archer S, Bidlack JM.","Eur J Pharmacol. 1993 Aug 24;240(2-3):201-6. doi: 10.1016/0014-2999(93)90899-s.","Jiang Q","Eur J Pharmacol","1993","1993/08/24","","","10.1016/0014-2999(93)90899-s"
"7694538","Pain measurement in hospitalized adults with sickle cell painful episodes","Ballas SK, Delengowski A.","Ann Clin Lab Sci. 1993 Sep-Oct;23(5):358-61.","Ballas SK","Ann Clin Lab Sci","1993","1993/09/01","","",""
"7693944","14 beta-[(p-nitrocinnamoyl)amino]morphinones, 14 beta-[(p-nitrocinnamoyl)amino]-7,8-dihydromorphinones, and their codeinone analogues: synthesis and receptor activity","Sebastian A, Bidlack JM, Jiang Q, Deecher D, Teitler M, Glick SD, Archer S.","J Med Chem. 1993 Oct 15;36(21):3154-60. doi: 10.1021/jm00073a015.","Sebastian A","J Med Chem","1993","1993/10/15","","","10.1021/jm00073a015"
"7693389","CYP2D6 phenotype determines the metabolic conversion of hydrocodone to hydromorphone","Otton SV, Schadel M, Cheung SW, Kaplan HL, Busto UE, Sellers EM.","Clin Pharmacol Ther. 1993 Nov;54(5):463-72. doi: 10.1038/clpt.1993.177.","Otton SV","Clin Pharmacol Ther","1993","1993/11/01","","","10.1038/clpt.1993.177"
"7690122","The distribution of medication along the spinal canal after chronic intrathecal administration","Kroin JS, Ali A, York M, Penn RD.","Neurosurgery. 1993 Aug;33(2):226-30; discussion 230.","Kroin JS","Neurosurgery","1993","1993/08/01","","",""
"7689317","Biological synthesis of the analgesic hydromorphone, an intermediate in the metabolism of morphine, by Pseudomonas putida M10","Hailes AM, Bruce NC.","Appl Environ Microbiol. 1993 Jul;59(7):2166-70.","Hailes AM","Appl Environ Microbiol","1993","1993/07/01","PMC182252","",""
"7688888","Opioid hyperexcitability: the application of alternate opioid therapy","MacDonald N, Der L, Allan S, Champion P.","Pain. 1993 Jun;53(3):353-5. doi: 10.1016/0304-3959(93)90232-e.","MacDonald N","Pain","1993","1993/06/01","","","10.1016/0304-3959(93)90232-e"
"7687147","Affinity labeling of the mu opioid receptor in bovine striatal membranes with [3H]-14 beta-(bromoacetamido)-7,8-dihydromorphine","Bidlack JM, Kaplan RA, Subbramanian RA, Seyed-Mozaffari A, Archer S.","Biochemistry. 1993 Jul 6;32(26):6703-11. doi: 10.1021/bi00077a025.","Bidlack JM","Biochemistry","1993","1993/07/06","","","10.1021/bi00077a025"
"7686955","A single case study using high-dose hydromorphone to control severe pain and serial psychometric testing to assess effects","Hays H, Mayo P.","J Pain Symptom Manage. 1993 Apr;8(3):173-6. doi: 10.1016/0885-3924(93)90146-m.","Hays H","J Pain Symptom Manage","1993","1993/04/01","","","10.1016/0885-3924(93)90146-m"
"7686279","Comparison of hydromorphone continuous subcutaneous infusion and basal rate subcutaneous infusion plus PCA in cancer pain: a pilot study","Vanier MC, Labrecque G, Lepage-Savary D, Poulin E, Provencher L, Lamontagne C.","Pain. 1993 Apr;53(1):27-32. doi: 10.1016/0304-3959(93)90051-p.","Vanier MC","Pain","1993","1993/04/01","","","10.1016/0304-3959(93)90051-p"
"7684078","Palliative care round: cognitive failure and coma after renal failure in a patient receiving captopril and hydromorphone","Fainsinger R, Schoeller T, Boiskin M, Bruera E.","J Palliat Care. 1993 Spring;9(1):53-5.","Fainsinger R","J Palliat Care","1993","1993/01/01","","",""
"7683827","Stroke following injection of a melted suppository","Bitar S, Gomez CR.","Stroke. 1993 May;24(5):741-3. doi: 10.1161/01.str.24.5.741.","Bitar S","Stroke","1993","1993/05/01","","","10.1161/01.str.24.5.741"
"7680715","Pharmacological study of 14 beta-(thioglycolamido)-7,8-dihydro-N(cyclopropylmethyl)-normor phinone (N-CPM-TAMO)","Jiang Q, Seyed-Mozaffari A, Archer S, Bidlack JM.","J Pharmacol Exp Ther. 1993 Mar;264(3):1021-7.","Jiang Q","J Pharmacol Exp Ther","1993","1993/03/01","","",""
"7679737","Differential naltrexone antagonism of hydromorphone and pentazocine effects in human volunteers","Preston KL, Bigelow GE.","J Pharmacol Exp Ther. 1993 Feb;264(2):813-23.","Preston KL","J Pharmacol Exp Ther","1993","1993/02/01","","",""
"7679076","5 beta-Methyl-14 beta-(p-nitrocinnamoylamino)-7,8-dihydromorphinone: a long-lasting mu-opioid receptor antagonist devoid of agonist properties","Jiang Q, Sebastian A, Archer S, Bidlack JM.","Eur J Pharmacol. 1993 Jan 5;230(1):129-30. doi: 10.1016/0014-2999(93)90423-f.","Jiang Q","Eur J Pharmacol","1993","1993/01/05","","","10.1016/0014-2999(93)90423-f"
"7574067","Epidural and intravenous opioid-induced neuroexcitation","Rozan JP, Kahn CH, Warfield CA.","Anesthesiology. 1995 Oct;83(4):860-3. doi: 10.1097/00000542-199510000-00027.","Rozan JP","Anesthesiology","1995","1995/10/01","","","10.1097/00000542-199510000-00027"
"7545736","Hydromorphone and metabolite pharmacokinetics in children","Babul N, Darke AC, Hain R.","J Pain Symptom Manage. 1995 Jul;10(5):335-7. doi: 10.1016/0885-3924(95)90012-8.","Babul N","J Pain Symptom Manage","1995","1995/07/01","","","10.1016/0885-3924(95)90012-8"
"7543126","Hydromorphone metabolite accumulation in renal failure","Babul N, Darke AC, Hagen N.","J Pain Symptom Manage. 1995 Apr;10(3):184-6. doi: 10.1016/0885-3924(94)00121-Z.","Babul N","J Pain Symptom Manage","1995","1995/04/01","","","10.1016/0885-3924(94)00121-Z"
"7542336","Acute administration of buprenorphine in humans: partial agonist and blockade effects","Walsh SL, Preston KL, Bigelow GE, Stitzer ML.","J Pharmacol Exp Ther. 1995 Jul;274(1):361-72.","Walsh SL","J Pharmacol Exp Ther","1995","1995/07/01","","",""
"7541438","Use of methadone in a highly tolerant patient receiving parenteral hydromorphone","Thomas Z, Bruera E.","J Pain Symptom Manage. 1995 May;10(4):315-7. doi: 10.1016/0885-3924(95)00011-M.","Thomas Z","J Pain Symptom Manage","1995","1995/05/01","","","10.1016/0885-3924(95)00011-M"
"7541310","Comparison of hydromorphone and meperidine for ureteral colic","Jasani NB, O'Conner RE, Bouzoukis JK.","Acad Emerg Med. 1994 Nov-Dec;1(6):539-43. doi: 10.1111/j.1553-2712.1994.tb02549.x.","Jasani NB","Acad Emerg Med","1994","1994/11/01","","","10.1111/j.1553-2712.1994.tb02549.x"
"7538514","Steady-state pharmacokinetics of hydromorphone and hydromorphone-3-glucuronide in cancer patients after immediate and controlled-release hydromorphone","Hagen N, Thirlwell MP, Dhaliwal HS, Babul N, Harsanyi Z, Darke AC.","J Clin Pharmacol. 1995 Jan;35(1):37-44. doi: 10.1002/j.1552-4604.1995.tb04743.x.","Hagen N","J Clin Pharmacol","1995","1995/01/01","","","10.1002/j.1552-4604.1995.tb04743.x"
"7536861","Forensic drug testing for opiates. VI. Urine testing for hydromorphone, hydrocodone, oxymorphone, and oxycodone with commercial opiate immunoassays and gas chromatography-mass spectrometry","Smith ML, Hughes RO, Levine B, Dickerson S, Darwin WD, Cone EJ.","J Anal Toxicol. 1995 Jan-Feb;19(1):18-26. doi: 10.1093/jat/19.1.18.","Smith ML","J Anal Toxicol","1995","1995/01/01","","","10.1093/jat/19.1.18"
"7533484","Intravenous versus epidural administration of hydromorphone. Effects on analgesia and recovery after radical retropubic prostatectomy","Liu S, Carpenter RL, Mulroy MF, Weissman RM, McGill TJ, Rupp SM, Allen HW.","Anesthesiology. 1995 Mar;82(3):682-8. doi: 10.1097/00000542-199503000-00010.","Liu S","Anesthesiology","1995","1995/03/01","","","10.1097/00000542-199503000-00010"
"7533480","Compatibility of hydromorphone hydrochloride with haloperidol lactate and ketorolac tromethamine","Huang E, Anderson RP.","Am J Hosp Pharm. 1994 Dec 1;51(23):2963.","Huang E","Am J Hosp Pharm","1994","1994/12/01","","",""
"7531852","Effects of diazepam and hydromorphone in triazolam-trained humans under a novel-response drug discrimination procedure","Oliveto AH, Bickel WK, Kamien JB, Hughes JR, Higgins ST.","Psychopharmacology (Berl). 1994 Apr;114(3):417-23. doi: 10.1007/BF02249331.","Oliveto AH","Psychopharmacology (Berl)","1994","1994/04/01","","","10.1007/BF02249331"
"7529849","Study of drug distribution in hair by infrared microscopy visualization","Kalasinsky KS, Magluilo J Jr, Schaefer T.","J Anal Toxicol. 1994 Oct;18(6):337-41. doi: 10.1093/jat/18.6.337.","Kalasinsky KS","J Anal Toxicol","1994","1994/10/01","","","10.1093/jat/18.6.337"
"7527184","Compatibility and stability of ondansetron hydrochloride with morphine sulfate and with hydromorphone hydrochloride in 0.9% sodium chloride injection at 4, 22, and 32 degrees C","Trissel LA, Xu Q, Martinez JF, Fox JL.","Am J Hosp Pharm. 1994 Sep 1;51(17):2138-42.","Trissel LA","Am J Hosp Pharm","1994","1994/09/01","","",""
"7525929","Drug discrimination assessment of agonist-antagonist opioids in humans: a three-choice saline-hydromorphone-butorphanol procedure","Preston KL, Bigelow GE.","J Pharmacol Exp Ther. 1994 Oct;271(1):48-60.","Preston KL","J Pharmacol Exp Ther","1994","1994/10/01","","",""
"7525741","Local tolerance to subcutaneous infusions of high concentrations of hydromorphone: a prospective study","Bruera E, MacEachern T, Macmillan K, Miller MJ, Hanson J.","J Pain Symptom Manage. 1993 May;8(4):201-4. doi: 10.1016/0885-3924(93)90128-i.","Bruera E","J Pain Symptom Manage","1993","1993/05/01","","","10.1016/0885-3924(93)90128-i"
"7522977","A comparison of pentamorphone and fentanyl in balanced anaesthesia during general surgery","Kelly WB, Howie MB, Romanelli VA, Duarte JA, Rezaei H, McSweeney TD.","Can J Anaesth. 1994 Aug;41(8):703-9. doi: 10.1007/BF03015625.","Kelly WB","Can J Anaesth","1994","1994/08/01","","","10.1007/BF03015625"
"7521784","Comparative clinical efficacy and safety of immediate release and controlled release hydromorphone for chronic severe cancer pain","Hays H, Hagen N, Thirlwell M, Dhaliwal H, Babul N, Harsanyi Z, Darke AC.","Cancer. 1994 Sep 15;74(6):1808-16. doi: 10.1002/1097-0142(19940915)74:6<1808::aid-cncr2820740625>3.0.co;2-y.","Hays H","Cancer","1994","1994/09/15","","","10.1002/1097-0142(19940915)74:6<1808::aid-cncr2820740625>3.0.co;2-y"
"7520516","Hydromorphone and hydrocodone interference in GC/MS assays for morphine and codeine","Fenton J, Mummert J, Childers M.","J Anal Toxicol. 1994 May-Jun;18(3):159-64. doi: 10.1093/jat/18.3.159.","Fenton J","J Anal Toxicol","1994","1994/05/01","","","10.1093/jat/18.3.159"
"7519977","Buprenorphine: duration of blockade of effects of intramuscular hydromorphone","Rosen MI, Wallace EA, McMahon TJ, Pearsall HR, Woods SW, Price LH, Kosten TR.","Drug Alcohol Depend. 1994 Apr;35(2):141-9. doi: 10.1016/0376-8716(94)90121-x.","Rosen MI","Drug Alcohol Depend","1994","1994/04/01","","","10.1016/0376-8716(94)90121-x"
"7518312","Clinical application of nebulized opioids for treatment of dyspnoea in patients with malignant disease","Farncombe M, Chater S.","Support Care Cancer. 1994 May;2(3):184-7. doi: 10.1007/BF00417478.","Farncombe M","Support Care Cancer","1994","1994/05/01","","","10.1007/BF00417478"
"7517691","Polyarthralgia and amenorrhea as a complication of intrathecally infused morphine and Dilaudid in the treatment of chronic benign back pain","Chambers FA, McCarroll M, MacSullivan R.","Br J Anaesth. 1994 Jun;72(6):734. doi: 10.1093/bja/72.6.734.","Chambers FA","Br J Anaesth","1994","1994/06/01","","","10.1093/bja/72.6.734"
"7517429","Altered sexual function and decreased testosterone in patients receiving intraspinal opioids","Paice JA, Penn RD, Ryan WG.","J Pain Symptom Manage. 1994 Feb;9(2):126-31. doi: 10.1016/0885-3924(94)90166-x.","Paice JA","J Pain Symptom Manage","1994","1994/02/01","","","10.1016/0885-3924(94)90166-x"
"7516635","Towards engineering pathways for the synthesis of analgesics and antitussives","Bruce NC, Caswell DA, French CE, Hailes AM, Long MT, Willey DL.","Ann N Y Acad Sci. 1994 May 2;721:85-99. doi: 10.1111/j.1749-6632.1994.tb47380.x.","Bruce NC","Ann N Y Acad Sci","1994","1994/05/02","","","10.1111/j.1749-6632.1994.tb47380.x"
